{
  "$schema": "https://json-schema.org/draft/2020-12/schema",
  "$id": "https://graffiti.dev/schema/map.schema.json",
  "title": "graffiti map.json",
  "description": "Directed knowledge graph emitted by graffiti for a code repository.",
  "type": "object",
  "additionalProperties": false,
  "required": ["version", "generated_at", "root", "nodes", "edges", "communities"],
  "properties": {
    "version": { "type": "string", "const": "1" },
    "generated_at": { "type": "string", "format": "date-time" },
    "root": { "type": "string" },
    "nodes": {
      "type": "array",
      "items": {
        "type": "object",
        "additionalProperties": false,
        "required": ["id", "label", "kind", "file", "line", "community"],
        "properties": {
          "id": { "type": "string", "minLength": 1 },
          "label": { "type": "string" },
          "kind": { "type": "string", "enum": ["function", "method", "class", "module", "file", "doc", "concept"] },
          "file": { "type": "string" },
          "line": { "type": "integer", "minimum": 0 },
          "community": { "type": "integer", "minimum": -1 }
        }
      }
    },
    "edges": {
      "type": "array",
      "items": {
        "type": "object",
        "additionalProperties": false,
        "required": ["from", "to", "relation", "confidence"],
        "properties": {
          "from": { "type": "string", "minLength": 1 },
          "to": { "type": "string", "minLength": 1 },
          "relation": { "type": "string", "enum": ["calls", "imports", "inherits", "implements", "references", "contains"] },
          "confidence": { "type": "string", "enum": ["EXTRACTED", "INFERRED", "AMBIGUOUS"] }
        }
      }
    },
    "communities": {
      "type": "array",
      "items": {
        "type": "object",
        "additionalProperties": false,
        "required": ["id", "label", "members"],
        "properties": {
          "id": { "type": "integer" },
          "label": { "type": "string" },
          "members": { "type": "array", "items": { "type": "string" } }
        }
      }
    }
  }
}
